{
  "$schema": "https://json-schema.org/draft/2020-12/schema",
  "$id": "https://cedh-research.local/schemas/interaction.schema.json",
  "title": "Interaction",
  "description": "A candidate or verified card interaction/combo/line. Lives in interactions/candidate/<id>.json until validated, then moves to interactions/verified/<id>.json. Only files in interactions/verified/ may be used as deterministic transitions in simulation (charter non-negotiable rule 1) - and per docs/VERIFICATION_LEVELS.md, only verification_level=ENGINE_EXACT_VERIFIED entries may be hardcoded as a fixed hop in a native (non-engine-driven) tracker; other verified tiers (RULES_VERIFIED, ENGINE_COMPONENT_VERIFIED, CONDITIONAL) may inform an engine-driven simulation but must not be hardcoded as if their exact transition were itself proven.",
  "type": "object",
  "required": [
    "id",
    "status",
    "name",
    "cards",
    "prerequisites",
    "result",
    "deterministic",
    "sources",
    "discovered_via"
  ],
  "properties": {
    "id": {"type": "string", "pattern": "^INT-[0-9]{4,}$"},
    "status": {"enum": ["candidate", "verified", "refuted"]},
    "verification_level": {
      "type": ["string", "null"],
      "enum": ["RULES_VERIFIED", "ENGINE_COMPONENT_VERIFIED", "ENGINE_EXACT_VERIFIED", null],
      "description": "Required (non-null) when status=verified; must be null otherwise. Orthogonal to `conditional` - an interaction can be ENGINE_EXACT_VERIFIED and conditional:true simultaneously (e.g. an opponent-payment-dependent line that is exactly engine-reproduced under the stated condition). See docs/VERIFICATION_LEVELS.md."
    },
    "conditional": {
      "type": ["boolean", "null"],
      "description": "Required (non-null) when status=verified; must be null otherwise. True if the result only holds under a stated condition/assumption this deck doesn't control (most commonly an opponent choice, e.g. declining to pay a tax). If true, `conditions` must be non-empty. False means the result is fully deck-controlled once prerequisites are met."
    },
    "conditions": {
      "type": "array",
      "items": {"type": "string"},
      "description": "Required non-empty when conditional=true. Each entry states one uncontrolled assumption (e.g. 'all opponents decline to pay Smothering Tithe's {2} tax') and, where relevant, what happens if it doesn't hold."
    },
    "name": {"type": "string"},
    "cards": {
      "type": "array",
      "minItems": 1,
      "items": {
        "type": "object",
        "required": ["scryfall_id", "name", "role"],
        "properties": {
          "scryfall_id": {"type": "string"},
          "name": {"type": "string"},
          "role": {"type": "string", "description": "e.g. 'engine piece', 'enabler', 'payoff'."}
        }
      }
    },
    "prerequisites": {
      "type": "object",
      "description": "Required for status=verified per charter Level 4 exact-line validation checklist.",
      "properties": {
        "zones": {"type": "array", "items": {"type": "string"}},
        "mana_available": {"type": ["string", "null"]},
        "timing": {"type": "string", "description": "e.g. 'main phase, sorcery speed', 'any time player has priority'."},
        "targets_required": {"type": "array", "items": {"type": "string"}},
        "other": {"type": "array", "items": {"type": "string"}}
      }
    },
    "result": {
      "type": "object",
      "required": ["summary", "is_win_condition"],
      "properties": {
        "summary": {"type": "string"},
        "is_win_condition": {"type": "boolean"},
        "is_loop": {"type": "boolean"},
        "loop_termination": {"type": ["string", "null"], "description": "Required detail if is_loop=true: what stops the loop and how the result is achieved."}
      }
    },
    "deterministic": {
      "type": "boolean",
      "description": "True only if the line has no dependency on opponent choices or randomness once prerequisites are met. Must be false for anything not yet Level-4-validated."
    },
    "verification": {
      "type": ["object", "null"],
      "description": "Required (non-null) when status=verified.",
      "properties": {
        "rules_citations": {"type": "array", "items": {"type": "string"}, "description": "Comprehensive Rules section numbers and/or Oracle rulings cited."},
        "executable_engine_check": {
          "type": ["object", "null"],
          "properties": {
            "engine": {"enum": ["forge", "xmage", "none"]},
            "reproduced": {"type": "boolean"},
            "exact_reproduction": {
              "type": "boolean",
              "description": "true only if this engine run reproduced the interaction's own full stated transition (prerequisites through result) end-to-end - the ENGINE_EXACT_VERIFIED case. false if it reproduced a component or downstream consequence of the interaction instead - the ENGINE_COMPONENT_VERIFIED case. See docs/VERIFICATION_LEVELS.md."
            },
            "notes": {"type": "string"}
          }
        },
        "verified_by": {"type": "string"},
        "verified_date": {"type": "string", "format": "date"}
      }
    },
    "sources": {
      "type": "array",
      "items": {
        "type": "object",
        "required": ["type", "reference"],
        "properties": {
          "type": {"enum": ["commander_spellbook", "primer", "manual_discovery", "comprehensive_rules", "oracle_ruling", "executable_engine"]},
          "reference": {"type": "string"}
        }
      }
    },
    "discovered_via": {
      "enum": ["commander_spellbook_pull", "pairwise_scan", "triple_scan", "higher_order_scan", "primer_reference", "manual_review"]
    },
    "coverage_backlog_ref": {"type": ["string", "null"], "description": "Backlog entry ID if this interaction is blocked on something."}
  },
  "additionalProperties": false,
  "allOf": [
    {
      "if": {"properties": {"status": {"const": "verified"}}},
      "then": {
        "properties": {
          "verification_level": {"enum": ["RULES_VERIFIED", "ENGINE_COMPONENT_VERIFIED", "ENGINE_EXACT_VERIFIED"]},
          "conditional": {"type": "boolean"}
        },
        "required": ["conditional"]
      },
      "else": {
        "properties": {
          "verification_level": {"const": null},
          "conditional": {"const": null}
        }
      }
    },
    {
      "if": {"properties": {"conditional": {"const": true}}},
      "then": {
        "properties": {"conditions": {"type": "array", "minItems": 1}}
      }
    }
  ]
}
